Importance,Level,Code,Occupation
94,87,47-5081.00,Helpers--Extraction Workers
93,74,47-5013.00,"Service Unit Operators, Oil and Gas"
92,90,51-4041.00,Machinists
92,84,47-2072.00,Pile Driver Operators
92,74,51-4021.00,"Extruding and Drawing Machine Setters, Operators, and Tenders, Metal and Plastic"
91,88,49-9095.00,Manufactured Building and Mobile Home Installers
91,86,47-2073.00,Operating Engineers and Other Construction Equipment Operators
91,83,49-9081.00,Wind Turbine Service Technicians
91,80,45-4022.00,Logging Equipment Operators
91,78,53-4011.00,Locomotive Engineers
91,73,51-5112.00,Printing Press Operators
90,85,29-1124.00,Radiation Therapists
90,70,51-9191.00,Adhesive Bonding Machine Operators and Tenders
89,82,51-4194.00,"Tool Grinders, Filers, and Sharpeners"
89,73,51-4072.00,"Molding, Coremaking, and Casting Machine Setters, Operators, and Tenders, Metal and Plastic"
89,66,47-2011.00,Boilermakers
88,84,51-4023.00,"Rolling Machine Setters, Operators, and Tenders, Metal and Plastic"
88,78,51-9021.00,"Crushing, Grinding, and Polishing Machine Setters, Operators, and Tenders"
88,74,51-9195.03,"Stone Cutters and Carvers, Manufacturing"
88,72,51-9193.00,Cooling and Freezing Equipment Operators and Tenders
88,70,47-5023.00,"Earth Drillers, Except Oil and Gas"
87,90,51-8013.04,Hydroelectric Plant Technicians
87,81,51-4033.00,"Grinding, Lapping, Polishing, and Buffing Machine Tool Setters, Operators, and Tenders, Metal and Plastic"
87,72,53-5011.00,Sailors and Marine Oilers
86,82,51-4034.00,"Lathe and Turning Machine Tool Setters, Operators, and Tenders, Metal and Plastic"
86,79,53-4013.00,"Rail Yard Engineers, Dinkey Operators, and Hostlers"
86,73,51-9041.00,"Extruding, Forming, Pressing, and Compacting Machine Setters, Operators, and Tenders"
86,72,51-9196.00,"Paper Goods Machine Setters, Operators, and Tenders"
86,72,47-5012.00,"Rotary Drill Operators, Oil and Gas"
86,72,51-6042.00,Shoe Machine Operators and Tenders
86,65,47-5011.00,"Derrick Operators, Oil and Gas"
86,65,51-3092.00,Food Batchmakers
85,92,51-9162.00,Computer Numerically Controlled Tool Programmers
85,87,53-7071.00,Gas Compressor and Gas Pumping Station Operators
85,81,51-9161.00,Computer Numerically Controlled Tool Operators
85,81,47-5022.00,"Excavating and Loading Machine and Dragline Operators, Surface Mining"
85,81,51-4062.00,"Patternmakers, Metal and Plastic"
85,79,51-4032.00,"Drilling and Boring Machine Tool Setters, Operators, and Tenders, Metal and Plastic"
85,77,47-5043.00,"Roof Bolters, Mining"
85,76,51-8013.00,Power Plant Operators
85,75,51-8093.00,"Petroleum Pump System Operators, Refinery Operators, and Gaugers"
85,73,51-8031.00,Water and Wastewater Treatment Plant and System Operators
85,70,47-2151.00,Pipelayers
85,68,47-2071.00,"Paving, Surfacing, and Tamping Equipment Operators"
85,67,51-6091.00,"Extruding and Forming Machine Setters, Operators, and Tenders, Synthetic and Glass Fibers"
84,86,51-4081.00,"Multiple Machine Tool Setters, Operators, and Tenders, Metal and Plastic"
84,79,47-5041.00,Continuous Mining Machine Operators
84,73,49-9051.00,Electrical Power-Line Installers and Repairers
84,70,47-2061.00,Construction Laborers
84,68,51-9051.00,"Furnace, Kiln, Oven, Drier, and Kettle Operators and Tenders"
83,88,51-4061.00,"Model Makers, Metal and Plastic"
83,83,53-2011.00,"Airline Pilots, Copilots, and Flight Engineers"
83,74,51-2031.00,Engine and Other Machine Assemblers
83,73,51-8013.03,Biomass Plant Technicians
83,73,45-4021.00,Fallers
82,81,53-2012.00,Commercial Pilots
82,78,49-9099.01,Geothermal Technicians
82,75,53-7021.00,Crane and Tower Operators
82,72,53-7081.00,Refuse and Recyclable Material Collectors
82,69,51-5113.00,Print Binding and Finishing Workers
82,66,51-4071.00,Foundry Mold and Coremakers
81,84,51-7032.00,"Patternmakers, Wood"
81,83,51-8021.00,Stationary Engineers and Boiler Operators
81,70,51-9141.00,Semiconductor Processing Technicians
81,64,51-4022.00,"Forging Machine Setters, Operators, and Tenders, Metal and Plastic"
81,63,53-7031.00,Dredge Operators
81,54,51-9151.00,Photographic Process Workers and Processing Machine Operators
80,82,29-1211.00,Anesthesiologists
80,81,29-1241.00,"Ophthalmologists, Except Pediatric"
80,79,51-4191.00,"Heat Treating Equipment Setters, Operators, and Tenders, Metal and Plastic"
80,77,19-4051.00,Nuclear Technicians
80,75,11-9199.09,Wind Energy Operations Managers
80,73,51-2011.00,"Aircraft Structure, Surfaces, Rigging, and Systems Assemblers"
80,72,49-3042.00,"Mobile Heavy Equipment Mechanics, Except Engines"
80,71,51-9011.00,Chemical Equipment Operators and Tenders
80,71,49-3052.00,Motorcycle Mechanics
80,71,51-9197.00,Tire Builders
80,69,51-9032.00,"Cutting and Slicing Machine Setters, Operators, and Tenders"
80,68,51-8099.01,Biofuels Processing Technicians
80,62,51-8091.00,Chemical Plant and System Operators
80,49,27-4031.00,"Camera Operators, Television, Video, and Film"
79,82,51-8011.00,Nuclear Power Reactor Operators
79,78,47-4021.00,Elevator and Escalator Installers and Repairers
79,76,51-4035.00,"Milling and Planing Machine Setters, Operators, and Tenders, Metal and Plastic"
79,71,47-2051.00,Cement Masons and Concrete Finishers
79,67,53-7011.00,Conveyor Operators and Tenders
79,64,51-3093.00,Food Cooking Machine Operators and Tenders
79,63,53-7062.04,Recycling and Reclamation Workers
79,60,45-2091.00,Agricultural Equipment Operators
79,51,35-3023.01,Baristas
78,78,53-7041.00,Hoist and Winch Operators
78,75,27-4014.00,Sound Engineering Technicians
78,74,51-7011.00,Cabinetmakers and Bench Carpenters
78,71,49-2093.00,"Electrical and Electronics Installers and Repairers, Transportation Equipment"
78,71,51-9022.00,"Grinding and Polishing Workers, Hand"
78,70,51-7041.00,"Sawing Machine Setters, Operators, and Tenders, Wood"
78,69,53-5031.00,Ship Engineers
78,69,51-6063.00,"Textile Knitting and Weaving Machine Setters, Operators, and Tenders"
78,68,29-2034.00,Radiologic Technologists and Technicians
78,65,53-6011.00,Bridge and Lock Tenders
78,64,53-7073.00,Wellhead Pumpers
77,78,49-9043.00,"Maintenance Workers, Machinery"
77,74,51-9195.04,"Glass Blowers, Molders, Benders, and Finishers"
77,73,47-2043.00,Floor Sanders and Finishers
77,72,49-2092.00,"Electric Motor, Power Tool, and Related Repairers"
77,70,51-4031.00,"Cutting, Punching, and Press Machine Setters, Operators, and Tenders, Metal and Plastic"
77,66,49-9071.00,"Maintenance and Repair Workers, General"
77,63,53-6031.00,Automotive and Watercraft Service Attendants
76,72,49-9021.00,"Heating, Air Conditioning, and Refrigeration Mechanics and Installers"
76,72,51-4192.00,"Layout Workers, Metal and Plastic"
76,72,51-9195.05,"Potters, Manufacturing"
76,72,17-3024.01,Robotics Technicians
76,65,51-4193.00,"Plating Machine Setters, Operators, and Tenders, Metal and Plastic"
76,64,47-2053.00,Terrazzo Workers and Finishers
76,60,29-2031.00,Cardiovascular Technologists and Technicians
76,56,51-9192.00,"Cleaning, Washing, and Metal Pickling Equipment Operators and Tenders"
75,79,17-3026.01,Nanotechnology Engineering Technologists and Technicians
75,70,53-5021.00,"Captains, Mates, and Pilots of Water Vessels"
75,69,51-7042.00,"Woodworking Machine Setters, Operators, and Tenders, Except Sawing"
75,67,49-9094.00,Locksmiths and Safe Repairers
75,65,51-9198.00,Helpers--Production Workers
74,78,29-1021.00,"Dentists, General"
74,76,17-2199.08,Robotics Engineers
74,67,51-3091.00,"Food and Tobacco Roasting, Baking, and Drying Machine Operators and Tenders"
74,62,51-9194.00,Etchers and Engravers
74,61,51-6062.00,"Textile Cutting Machine Setters, Operators, and Tenders"
73,80,49-9044.00,Millwrights
73,67,49-2095.00,"Electrical and Electronics Repairers, Powerhouse, Substation, and Relay"
73,60,47-4031.00,Fence Erectors
73,60,47-4061.00,Rail-Track Laying and Maintenance Equipment Operators
73,59,51-9023.00,"Mixing and Blending Machine Setters, Operators, and Tenders"
73,57,19-4013.00,Food Science Technicians
73,57,51-6021.00,"Pressers, Textile, Garment, and Related Materials"
72,71,29-1126.00,Respiratory Therapists
72,69,47-5032.00,"Explosives Workers, Ordnance Handling Experts, and Blasters"
72,67,51-4121.00,"Welders, Cutters, Solderers, and Brazers"
72,63,53-7063.00,Machine Feeders and Offbearers
72,61,53-7072.00,"Pump Operators, Except Wellhead Pumpers"
72,59,37-3013.00,Tree Trimmers and Pruners
72,58,51-4122.00,"Welding, Soldering, and Brazing Machine Setters, Operators, and Tenders"
71,74,49-9041.00,Industrial Machinery Mechanics
71,73,17-3024.00,Electro-Mechanical and Mechatronics Technologists and Technicians
71,70,33-2011.00,Firefighters
71,70,33-1021.00,First-Line Supervisors of Firefighting and Prevention Workers
71,70,53-7121.00,"Tank Car, Truck, and Ship Loaders"
71,68,29-1151.00,Nurse Anesthetists
71,65,31-9093.00,Medical Equipment Preparers
71,65,51-4052.00,"Pourers and Casters, Metal"
71,65,47-2221.00,Structural Iron and Steel Workers
71,63,29-9093.00,Surgical Assistants
71,63,51-6052.00,"Tailors, Dressmakers, and Custom Sewers"
71,59,51-1011.00,First-Line Supervisors of Production and Operating Workers
70,71,49-3011.00,Aircraft Mechanics and Service Technicians
70,68,53-3032.00,Heavy and Tractor-Trailer Truck Drivers
70,67,51-8092.00,Gas Plant Operators
70,67,47-3011.00,"Helpers--Brickmasons, Blockmasons, Stonemasons, and Tile and Marble Setters"
70,61,29-2033.00,Nuclear Medicine Technologists
70,60,31-9099.02,Endoscopy Technicians
70,56,37-3011.00,Landscaping and Groundskeeping Workers
70,55,29-2011.00,Medical and Clinical Laboratory Technologists
69,75,51-4111.00,Tool and Die Makers
69,74,29-1024.00,Prosthodontists
69,69,49-9063.00,Musical Instrument Repairers and Tuners
69,67,51-7031.00,"Model Makers, Wood"
69,65,49-9096.00,Riggers
69,64,11-3051.04,Biomass Power Plant Managers
69,63,51-2092.00,Team Assemblers
69,62,47-5071.00,"Roustabouts, Oil and Gas"
69,61,45-1011.00,"First-Line Supervisors of Farming, Fishing, and Forestry Workers"
69,57,47-2211.00,Sheet Metal Workers
69,54,47-3015.00,"Helpers--Pipelayers, Plumbers, Pipefitters, and Steamfitters"
69,54,43-5111.00,"Weighers, Measurers, Checkers, and Samplers, Recordkeeping"
68,68,17-3029.08,Photonics Technicians
68,66,49-2094.00,"Electrical and Electronics Repairers, Commercial and Industrial Equipment"
68,63,47-1011.00,First-Line Supervisors of Construction Trades and Extraction Workers
68,62,49-9092.00,Commercial Divers
68,62,53-4022.00,"Railroad Brake, Signal, and Switch Operators and Locomotive Firers"
68,51,51-3022.00,"Meat, Poultry, and Fish Cutters and Trimmers"
68,49,29-1181.00,Audiologists
67,71,17-2199.09,Nanosystems Engineers
67,68,49-3041.00,Farm Equipment Mechanics and Service Technicians
67,67,47-4051.00,Highway Maintenance Workers
67,66,49-2091.00,Avionics Technicians
67,64,53-4041.00,Subway and Streetcar Operators
67,62,47-3012.00,Helpers--Carpenters
67,61,49-3051.00,Motorboat Mechanics and Service Technicians
67,59,51-9195.00,"Molders, Shapers, and Casters, Except Metal and Plastic"
67,59,49-3053.00,Outdoor Power Equipment and Other Small Engine Mechanics
67,59,47-4091.00,Segmental Pavers
67,57,29-2032.00,Diagnostic Medical Sonographers
67,54,53-7062.00,"Laborers and Freight, Stock, and Material Movers, Hand"
67,49,33-3041.00,Parking Enforcement Workers
66,72,51-2041.00,Structural Metal Fabricators and Fitters
66,68,49-3043.00,Rail Car Repairers
66,61,51-9012.00,"Separating, Filtering, Clarifying, Precipitating, and Still Machine Setters, Operators, and Tenders"
66,59,51-6061.00,Textile Bleaching and Dyeing Machine Operators and Tenders
66,57,49-1011.00,"First-Line Supervisors of Mechanics, Installers, and Repairers"
66,55,51-2051.00,Fiberglass Laminators and Fabricators
66,48,51-6011.00,Laundry and Dry-Cleaning Workers
65,71,51-9081.00,Dental Laboratory Technicians
65,68,49-3023.00,Automotive Service Technicians and Mechanics
65,67,49-9064.00,Watch and Clock Repairers
65,66,37-1012.00,"First-Line Supervisors of Landscaping, Lawn Service, and Groundskeeping Workers"
65,58,29-2091.00,Orthotists and Prosthetists
65,58,47-2152.00,"Plumbers, Pipefitters, and Steamfitters"
65,56,47-5051.00,"Rock Splitters, Quarry"
65,56,51-2061.00,Timing Device Assemblers and Adjusters
65,54,19-4031.00,Chemical Technicians
65,46,31-9096.00,Veterinary Assistants and Laboratory Animal Caretakers
65,42,39-3021.00,Motion Picture Projectionists
64,69,11-3051.00,Industrial Production Managers
64,65,29-1071.01,Anesthesiologist Assistants
64,62,53-1041.00,Aircraft Cargo Handling Supervisors
64,61,35-1011.00,Chefs and Head Cooks
64,60,47-2121.00,Glaziers
64,58,51-3021.00,Butchers and Meat Cutters
64,57,49-9098.00,"Helpers--Installation, Maintenance, and Repair Workers"
64,53,27-4012.00,Broadcast Technicians
63,60,39-6011.00,Baggage Porters and Bellhops
63,57,51-2023.00,Electromechanical Equipment Assemblers
63,54,53-7051.00,Industrial Truck and Tractor Operators
63,51,27-4011.00,Audio and Video Technicians
63,38,43-9051.00,"Mail Clerks and Mail Machine Operators, Except Postal Service"
62,60,47-2031.00,Carpenters
62,55,19-4043.00,"Geological Technicians, Except Hydrologic Technicians"
62,55,51-6051.00,"Sewers, Hand"
62,51,45-2093.00,"Farmworkers, Farm, Ranch, and Aquacultural Animals"
62,51,37-3012.00,"Pesticide Handlers, Sprayers, and Applicators, Vegetation"
61,65,29-1022.00,Oral and Maxillofacial Surgeons
61,62,19-1021.00,Biochemists and Biophysicists
61,62,51-2022.00,Electrical and Electronic Equipment Assemblers
61,61,19-4012.00,Agricultural Technicians
61,59,11-9013.00,"Farmers, Ranchers, and Other Agricultural Managers"
61,59,29-2012.00,Medical and Clinical Laboratory Technicians
61,55,51-9082.00,Medical Appliance Technicians
61,55,51-4051.00,Metal-Refining Furnace Operators and Tenders
61,55,51-9111.00,Packaging and Filling Machine Operators and Tenders
61,55,49-3092.00,Recreational Vehicle Service Technicians
61,51,51-6064.00,"Textile Winding, Twisting, and Drawing Out Machine Setters, Operators, and Tenders"
61,50,47-4099.03,Weatherization Installers and Technicians
61,48,35-1012.00,First-Line Supervisors of Food Preparation and Serving Workers
61,47,43-5011.00,Cargo and Freight Agents
60,66,17-3027.01,Automotive Engineering Technicians
60,58,19-4071.00,Forest and Conservation Technicians
60,57,47-2041.00,Carpet Installers
60,56,47-2181.00,Roofers
60,56,49-3093.00,Tire Repairers and Changers
60,55,19-2031.00,Chemists
60,55,51-9083.00,Ophthalmic Laboratory Technicians
60,54,49-3091.00,Bicycle Repairers
60,54,47-1011.03,Solar Energy Installation Managers
60,51,19-4092.00,Forensic Science Technicians
60,50,53-1042.00,"First-Line Supervisors of Helpers, Laborers, and Material Movers, Hand"
60,50,51-6031.00,Sewing Machine Operators
60,44,43-9071.00,"Office Machine Operators, Except Computer"
60,44,51-5111.00,Prepress Technicians and Workers
60,42,47-4071.00,Septic Tank Servicers and Sewer Pipe Cleaners
59,57,29-1141.03,Critical Care Nurses
59,57,53-4031.00,Railroad Conductors and Yardmasters
59,55,51-9071.00,Jewelers and Precious Stone and Metal Workers
59,55,51-8012.00,Power Distributors and Dispatchers
59,52,53-2022.00,Airfield Operations Specialists
59,52,51-2021.00,"Coil Winders, Tapers, and Finishers"
59,46,19-1022.00,Microbiologists
59,44,35-2014.00,"Cooks, Restaurant"
59,38,41-2011.00,Cashiers
58,63,17-2199.05,Mechatronics Engineers
58,62,17-3026.00,Industrial Engineering Technologists and Technicians
58,58,47-2161.00,Plasterers and Stucco Masons
58,54,51-9061.00,"Inspectors, Testers, Sorters, Samplers, and Weighers"
58,53,49-9012.00,"Control and Valve Installers and Repairers, Except Mechanical Door"
58,50,47-2131.00,"Insulation Workers, Floor, Ceiling, and Wall"
58,49,49-9052.00,Telecommunications Line Installers and Repairers
58,47,19-4099.03,Remote Sensing Technicians
57,58,25-1194.00,"Career/Technical Education Teachers, Postsecondary"
57,58,17-3023.00,Electrical and Electronic Engineering Technologists and Technicians
57,57,29-2035.00,Magnetic Resonance Imaging Technologists
57,56,11-9041.01,Biofuels/Biodiesel Technology and Product Development Managers
57,45,39-4011.00,Embalmers
56,61,27-2021.00,Athletes and Sports Competitors
56,60,51-9124.00,"Coating, Painting, and Spraying Machine Setters, Operators, and Tenders"
56,59,47-2021.00,Brickmasons and Blockmasons
56,57,17-2112.03,Manufacturing Engineers
56,56,17-3029.01,Non-Destructive Testing Specialists
56,54,29-2011.01,Cytogenetic Technologists
56,53,37-1011.00,First-Line Supervisors of Housekeeping and Janitorial Workers
56,50,29-2099.01,Neurodiagnostic Technologists
56,50,29-2099.05,Ophthalmic Medical Technologists
56,49,29-2056.00,Veterinary Technologists and Technicians
56,48,29-1041.00,Optometrists
56,48,47-2231.00,Solar Photovoltaic Installers
56,47,53-7064.00,"Packers and Packagers, Hand"
55,55,51-6093.00,Upholsterers
55,51,47-2111.00,Electricians
55,50,29-2055.00,Surgical Technologists
54,60,17-3027.00,Mechanical Engineering Technologists and Technicians
54,60,49-9062.00,Medical Equipment Repairers
54,57,47-2044.00,Tile and Stone Setters
54,55,17-2112.00,Industrial Engineers
54,53,11-3051.03,Biofuels Production Managers
54,53,27-2012.05,Media Technical Directors/Managers
54,51,35-9021.00,Dishwashers
54,51,47-4041.00,Hazardous Materials Removal Workers
54,46,51-9031.00,"Cutters and Trimmers, Hand"
54,46,29-2051.00,Dietetic Technicians
53,61,29-1224.00,Radiologists
53,56,17-1022.00,Surveyors
53,53,49-9045.00,"Refractory Materials Repairers, Except Brickmasons"
53,52,15-1244.00,Network and Computer Systems Administrators
53,51,45-4011.00,Forest and Conservation Workers
53,49,41-2022.00,Parts Salespersons
53,47,33-2022.00,Forest Fire Inspectors and Prevention Specialists
53,47,31-2012.00,Occupational Therapy Aides
53,47,33-9093.00,Transportation Security Screeners
53,45,49-9011.00,Mechanical Door Repairers
53,44,53-6041.00,Traffic Technicians
52,63,17-2199.07,Photonics Engineers
52,56,29-1141.01,Acute Care Nurses
52,56,49-3031.00,Bus and Truck Mechanics and Diesel Engine Specialists
52,55,27-1012.00,Craft Artists
52,55,11-3051.06,Hydroelectric Production Managers
52,54,29-1229.04,Physical Medicine and Rehabilitation Physicians
52,54,49-9097.00,Signal and Track Switch Repairers
52,52,47-5044.00,"Loading and Moving Machine Operators, Underground Mining"
52,47,35-3041.00,"Food Servers, Nonrestaurant"
52,47,43-5071.00,"Shipping, Receiving, and Inventory Clerks"
52,45,53-3052.00,"Bus Drivers, Transit and Intercity"
52,44,43-5053.00,"Postal Service Mail Sorters, Processors, and Processing Machine Operators"
52,43,19-4099.01,Quality Control Analysts
52,41,19-4021.00,Biological Technicians
52,34,35-2012.00,"Cooks, Institution and Cafeteria"
51,53,49-3021.00,Automotive Body and Related Repairers
51,50,31-9092.00,Medical Assistants
51,49,53-6051.07,"Transportation Vehicle, Equipment and Systems Inspectors, Except Aviation"
51,47,17-3021.00,Aerospace Engineering and Operations Technologists and Technicians
51,44,27-3011.00,Broadcast Announcers and Radio Disc Jockeys
51,39,39-3092.00,Costume Attendants
50,53,39-4021.00,Funeral Attendants
50,52,47-2171.00,Reinforcing Iron and Rebar Workers
50,45,53-3011.00,"Ambulance Drivers and Attendants, Except Emergency Medical Technicians"
50,45,45-4023.00,Log Graders and Scalers
50,45,31-9097.00,Phlebotomists
50,41,51-3023.00,Slaughterers and Meat Packers
50,40,29-1292.00,Dental Hygienists
50,40,47-2141.00,"Painters, Construction and Maintenance"
49,56,19-1012.00,Food Scientists and Technologists
49,55,47-3016.00,Helpers--Roofers
49,55,17-2199.06,Microsystems Engineers
49,54,51-9071.06,Gem and Diamond Workers
49,52,29-1291.00,Acupuncturists
49,50,33-3031.00,Fish and Game Wardens
49,49,25-4013.00,Museum Technicians and Conservators
49,49,49-2021.00,"Radio, Cellular, and Tower Equipment Installers and Repairers"
49,48,29-1128.00,Exercise Physiologists
49,48,35-2021.00,Food Preparation Workers
49,47,47-2152.04,Solar Thermal Installers and Technicians
49,45,19-1029.02,Molecular and Cellular Biologists
49,40,43-4181.00,Reservation and Transportation Ticket Agents and Travel Clerks
49,36,41-2031.00,Retail Salespersons
48,64,17-2131.00,Materials Engineers
48,52,11-9121.00,Natural Sciences Managers
48,51,19-2032.00,Materials Scientists
48,48,29-1222.00,"Physicians, Pathologists"
48,43,39-5011.00,Barbers
48,43,29-2092.00,Hearing Aid Specialists
48,43,19-1031.02,Range Managers
48,41,53-5022.00,Motorboat Operators
48,40,11-3012.00,Administrative Services Managers
48,39,27-1014.00,Special Effects Artists and Animators
48,38,31-1132.00,Orderlies
48,38,29-2052.00,Pharmacy Technicians
47,57,49-2096.00,"Electronic Equipment Installers and Repairers, Motor Vehicles"
47,57,17-2072.00,"Electronics Engineers, Except Computer"
47,51,17-2112.02,Validation Engineers
47,50,29-1011.00,Chiropractors
47,46,51-7021.00,Furniture Finishers
47,45,33-3051.04,Customs and Border Protection Officers
47,44,27-1013.00,"Fine Artists, Including Painters, Sculptors, and Illustrators"
47,44,43-3071.00,Tellers
47,41,47-4011.01,Energy Auditors
47,39,17-3031.00,Surveying and Mapping Technicians
47,36,35-3031.00,Waiters and Waitresses
47,34,29-1141.00,Registered Nurses
47,30,39-3031.00,"Ushers, Lobby Attendants, and Ticket Takers"
46,48,47-2042.00,"Floor Layers, Except Carpet, Wood, and Hard Tiles"
46,47,19-1032.00,Foresters
46,46,31-9091.00,Dental Assistants
46,44,53-3033.00,Light Truck Drivers
46,44,27-4021.00,Photographers
46,42,49-2022.00,"Telecommunications Equipment Installers and Repairers, Except Line Installers"
46,36,53-7065.00,Stockers and Order Fillers
46,35,25-2023.00,"Career/Technical Education Teachers, Middle School"
46,34,45-2041.00,"Graders and Sorters, Agricultural Products"
46,34,53-6021.00,Parking Attendants
45,50,19-4012.01,Precision Agriculture Technicians
45,48,25-1121.00,"Art, Drama, and Music Teachers, Postsecondary"
45,47,49-2011.00,"Computer, Automated Teller, and Office Machine Repairers"
45,46,17-1022.01,Geodetic Surveyors
45,43,25-2032.00,"Career/Technical Education Teachers, Secondary School"
45,42,31-2011.00,Occupational Therapy Assistants
45,42,31-9095.00,Pharmacy Aides
45,41,41-1012.00,First-Line Supervisors of Non-Retail Sales Workers
45,32,35-2015.00,"Cooks, Short Order"
45,32,49-2098.00,Security and Fire Alarm Systems Installers
44,47,29-1081.00,Podiatrists
44,46,27-1021.00,Commercial and Industrial Designers
44,45,19-4051.02,Nuclear Monitoring Technicians
44,42,11-3051.01,Quality Control Systems Managers
44,41,45-3031.00,Fishing and Hunting Workers
44,40,47-2082.00,Tapers
44,36,53-7061.00,Cleaners of Vehicles and Equipment
44,36,37-2021.00,Pest Control Workers
44,35,51-6041.00,Shoe and Leather Workers and Repairers
43,50,17-2161.00,Nuclear Engineers
43,45,53-1043.00,First-Line Supervisors of Material-Moving Machine and Vehicle Operators
43,44,13-1121.00,"Meeting, Convention, and Event Planners"
43,44,47-2022.00,Stonemasons
43,43,43-5061.00,"Production, Planning, and Expediting Clerks"
43,42,17-3025.00,Environmental Engineering Technologists and Technicians
43,41,25-1031.00,"Architecture Teachers, Postsecondary"
43,41,17-2072.01,Radio Frequency Identification Device Specialists
43,36,33-3011.00,Bailiffs
43,35,29-2057.00,Ophthalmic Medical Technicians
43,30,11-9051.00,Food Service Managers
42,47,29-1229.03,Urologists
42,45,25-1071.00,"Health Specialties Teachers, Postsecondary"
42,42,43-5021.00,Couriers and Messengers
42,42,29-1216.00,General Internal Medicine Physicians
42,42,47-3013.00,Helpers--Electricians
42,41,29-1023.00,Orthodontists
42,40,49-3022.00,Automotive Glass Installers and Repairers
42,40,37-2011.00,"Janitors and Cleaners, Except Maids and Housekeeping Cleaners"
42,39,33-9092.00,"Lifeguards, Ski Patrol, and Other Recreational Protective Service Workers"
42,39,31-2021.00,Physical Therapist Assistants
42,38,31-2022.00,Physical Therapist Aides
42,35,11-1021.00,General and Operations Managers
42,35,21-1011.00,Substance Abuse and Behavioral Disorder Counselors
42,34,41-2012.00,Gambling Change Persons and Booth Cashiers
42,31,41-2021.00,Counter and Rental Clerks
42,25,21-1094.00,Community Health Workers
41,43,53-6051.01,Aviation Inspectors
41,41,47-2132.00,"Insulation Workers, Mechanical"
41,39,33-2021.00,Fire Inspectors and Investigators
41,36,49-2097.00,Audiovisual Equipment Installers and Repairers
41,31,31-1131.00,Nursing Assistants
41,30,45-2092.00,"Farmworkers and Laborers, Crop, Nursery, and Greenhouse"
40,45,19-1029.04,Biologists
40,44,29-1218.00,Obstetricians and Gynecologists
40,38,29-2011.02,Cytotechnologists
40,36,11-9131.00,Postmasters and Mail Superintendents
40,36,17-2199.10,Wind Energy Engineers
40,32,51-6092.00,Fabric and Apparel Patternmakers
40,30,35-3023.00,Fast Food and Counter Workers
40,28,27-1026.00,Merchandise Displayers and Window Trimmers
40,26,41-9011.00,Demonstrators and Product Promoters
39,46,19-5011.00,Occupational Health and Safety Specialists
39,44,47-2081.00,Drywall and Ceiling Tile Installers
39,44,17-2141.00,Mechanical Engineers
39,43,25-1032.00,"Engineering Teachers, Postsecondary"
39,43,17-2141.01,Fuel Cell Engineers
39,42,51-3011.00,Bakers
39,40,29-2061.00,Licensed Practical and Licensed Vocational Nurses
39,40,29-1229.06,Sports Medicine Physicians
39,38,53-3031.00,Driver/Sales Workers
39,38,43-5041.00,"Meter Readers, Utilities"
39,38,33-3021.02,Police Identification and Records Officers
39,35,53-1042.01,Recycling Coordinators
39,34,29-2081.00,"Opticians, Dispensing"
39,33,43-5051.00,Postal Service Clerks
39,31,29-1123.00,Physical Therapists
39,31,39-5094.00,Skincare Specialists
39,28,11-9179.02,Spa Managers
39,22,45-2021.00,Animal Breeders
38,48,25-1054.00,"Physics Teachers, Postsecondary"
38,40,25-1041.00,"Agricultural Sciences Teachers, Postsecondary"
38,38,27-2012.03,Media Programming Directors
38,37,17-2041.00,Chemical Engineers
38,35,15-1232.00,Computer User Support Specialists
38,35,11-9081.00,Lodging Managers
38,32,39-4031.00,"Morticians, Undertakers, and Funeral Arrangers"
38,30,21-1091.00,Health Education Specialists
38,27,27-4032.00,Film and Video Editors
37,50,19-1013.00,Soil and Plant Scientists
